{
  "id": "mem_sec-003_working",
  "type": "working",
  "subtype": "agent-working-memory",
  "created_by": "SYSTEM",
  "created_at": "2025-12-18T00:00:00Z",
  "updated_at": "2025-12-18T00:00:00Z",
  "scope": "agent",
  "scope_id": "SEC-003",
  "tags": ["working", "agent", "sec"],
  "priority": "medium",
  "ttl": "PT4H",
  "content": {
    "current_task": null,
    "task_history": [],
    "notes": [],
    "pending_items": [],
    "context": {}
  },
  "access_count": 0,
  "last_accessed": null
}
