{
  "id": "mem_sec_incidents",
  "type": "procedural",
  "subtype": "incident-learnings",
  "created_by": "SYSTEM",
  "created_at": "2025-12-18T00:00:00Z",
  "updated_at": "2025-12-18T00:00:00Z",
  "scope": "team",
  "scope_id": "security",
  "tags": ["incidents", "learnings", "response", "procedures"],
  "priority": "critical",
  "ttl": "permanent",
  "content": {
    "description": "Learnings from past security incidents",
    "incidents": [],
    "playbooks": [],
    "lessons_learned": []
  },
  "access_count": 0,
  "last_accessed": null
}
