{
  "id": "mem_dev_archdec",
  "type": "semantic",
  "subtype": "architecture-decisions",
  "created_by": "SYSTEM",
  "created_at": "2025-12-18T00:00:00Z",
  "updated_at": "2025-12-18T00:00:00Z",
  "scope": "team",
  "scope_id": "development",
  "tags": ["architecture", "decisions", "adr", "design", "permanent"],
  "priority": "critical",
  "ttl": "permanent",
  "content": {
    "description": "Architecture Decision Records (ADRs) for the codebase",
    "decisions": []
  },
  "access_count": 0,
  "last_accessed": null
}
