{
  "id": "mem_systemconfig",
  "type": "factual",
  "subtype": "system-config",
  "created_by": "SYSTEM",
  "created_at": "2025-12-18T00:00:00Z",
  "updated_at": "2025-12-18T00:00:00Z",
  "scope": "global",
  "scope_id": null,
  "tags": ["system", "config", "hivemind", "permanent"],
  "priority": "critical",
  "ttl": "permanent",
  "content": {
    "hivemind_version": "1.0.0",
    "memory_version": "1.0.0",
    "teams": {
      "development": {
        "name": "Development & Architecture",
        "agents": ["DEV-001", "DEV-002", "DEV-003", "DEV-004", "DEV-005", "DEV-006"],
        "lead": "DEV-001"
      },
      "security": {
        "name": "Security & Compliance",
        "agents": ["SEC-001", "SEC-002", "SEC-003", "SEC-004", "SEC-005", "SEC-006"],
        "lead": "SEC-001"
      },
      "infrastructure": {
        "name": "Infrastructure & DevOps",
        "agents": ["INF-001", "INF-002", "INF-003", "INF-004", "INF-005", "INF-006"],
        "lead": "INF-001"
      },
      "qa": {
        "name": "Quality Assurance & Testing",
        "agents": ["QA-001", "QA-002", "QA-003", "QA-004", "QA-005", "QA-006"],
        "lead": "QA-001"
      }
    },
    "memory_settings": {
      "max_context_memories": 10,
      "session_timeout_hours": 4,
      "auto_archive_days": 90,
      "max_index_entries": 1000,
      "consolidation_threshold": 100
    },
    "priority_defaults": {
      "user_input": "high",
      "system_learning": "medium",
      "task_completion": "medium",
      "error_log": "high"
    }
  },
  "access_count": 0,
  "last_accessed": null
}
