{
  "id": "mem_terminology",
  "type": "semantic",
  "subtype": "terminology",
  "created_by": "SYSTEM",
  "created_at": "2025-12-18T00:00:00Z",
  "updated_at": "2025-12-18T00:00:00Z",
  "scope": "global",
  "scope_id": null,
  "tags": ["terminology", "glossary", "definitions", "semantic"],
  "priority": "high",
  "ttl": "permanent",
  "content": {
    "description": "Domain-specific terminology and definitions",
    "terms": {},
    "acronyms": {},
    "project_specific": {}
  },
  "access_count": 0,
  "last_accessed": null
}
