{
  "id": "mem_qa_envconfig",
  "type": "factual",
  "subtype": "environment-configs",
  "created_by": "SYSTEM",
  "created_at": "2025-12-18T00:00:00Z",
  "updated_at": "2025-12-18T00:00:00Z",
  "scope": "team",
  "scope_id": "qa",
  "tags": ["environment", "config", "testing", "setup"],
  "priority": "high",
  "ttl": "permanent",
  "content": {
    "description": "Test environment configurations",
    "environments": {},
    "data_sets": [],
    "fixtures": [],
    "setup_procedures": []
  },
  "access_count": 0,
  "last_accessed": null
}
