{
  "id": "mem_077aca7a89c5",
  "type": "episodic",
  "subtype": "known-bugs",
  "created_by": "SYSTEM",
  "created_at": "2025-12-18T00:00:00Z",
  "updated_at": "2025-12-18T00:00:00Z",
  "scope": "team",
  "scope_id": "qa",
  "tags": [
    "bugs",
    "issues",
    "defects",
    "tracking"
  ],
  "priority": "high",
  "ttl": "permanent",
  "content": {
    "description": "Known bugs and issues tracking",
    "active_bugs": [],
    "resolved_bugs": [],
    "patterns": []
  },
  "access_count": 0,
  "last_accessed": null
}
