{
  "id": "mem_inf_inventory",
  "type": "factual",
  "subtype": "system-inventory",
  "created_by": "SYSTEM",
  "created_at": "2025-12-18T00:00:00Z",
  "updated_at": "2025-12-18T00:00:00Z",
  "scope": "team",
  "scope_id": "infrastructure",
  "tags": ["inventory", "systems", "infrastructure", "assets"],
  "priority": "high",
  "ttl": "permanent",
  "content": {
    "description": "System and infrastructure inventory",
    "servers": [],
    "services": [],
    "databases": [],
    "networks": [],
    "cloud_resources": []
  },
  "access_count": 0,
  "last_accessed": null
}
