{
  "id": "mem_qa_regression",
  "type": "episodic",
  "subtype": "regression-history",
  "created_by": "SYSTEM",
  "created_at": "2025-12-18T00:00:00Z",
  "updated_at": "2025-12-18T00:00:00Z",
  "scope": "team",
  "scope_id": "qa",
  "tags": ["regression", "history", "testing", "results"],
  "priority": "medium",
  "ttl": "permanent",
  "content": {
    "description": "Regression testing history and results",
    "test_runs": [],
    "regressions_found": [],
    "flaky_tests": []
  },
  "access_count": 0,
  "last_accessed": null
}
