{
  "id": "mem_312e740e0c76",
  "type": "factual",
  "subtype": "codebase-knowledge",
  "created_by": "SYSTEM",
  "created_at": "2025-12-18T00:00:00Z",
  "updated_at": "2025-12-18T00:00:00Z",
  "scope": "team",
  "scope_id": "development",
  "tags": [
    "codebase",
    "knowledge",
    "development",
    "structure"
  ],
  "priority": "high",
  "ttl": "permanent",
  "content": {
    "description": "Knowledge about codebase structure, patterns, and conventions",
    "projects": {},
    "common_patterns": [],
    "file_conventions": {},
    "key_modules": [],
    "dependencies": {}
  },
  "access_count": 0,
  "last_accessed": null
}
