{
  "id": "mem_sec_threats",
  "type": "factual",
  "subtype": "threat-intelligence",
  "created_by": "SYSTEM",
  "created_at": "2025-12-18T00:00:00Z",
  "updated_at": "2025-12-18T00:00:00Z",
  "scope": "team",
  "scope_id": "security",
  "tags": ["threats", "intelligence", "security", "monitoring"],
  "priority": "critical",
  "ttl": "permanent",
  "content": {
    "description": "Threat intelligence and security monitoring data",
    "known_threats": [],
    "iocs": [],
    "attack_patterns": [],
    "mitigations": []
  },
  "access_count": 0,
  "last_accessed": null
}
