{
  "id": "mem_a341d3a9983b",
  "type": "factual",
  "subtype": "tech-debt",
  "created_by": "SYSTEM",
  "created_at": "2025-12-18T00:00:00Z",
  "updated_at": "2025-12-18T00:00:00Z",
  "scope": "team",
  "scope_id": "development",
  "tags": [
    "tech-debt",
    "refactoring",
    "improvement",
    "backlog"
  ],
  "priority": "medium",
  "ttl": "permanent",
  "content": {
    "description": "Technical debt tracking and improvement opportunities",
    "items": [],
    "resolved": []
  },
  "access_count": 0,
  "last_accessed": null
}
