{
  "id": "mem_qa_patterns",
  "type": "procedural",
  "subtype": "test-patterns",
  "created_by": "SYSTEM",
  "created_at": "2025-12-18T00:00:00Z",
  "updated_at": "2025-12-18T00:00:00Z",
  "scope": "team",
  "scope_id": "qa",
  "tags": ["testing", "patterns", "best-practices", "qa"],
  "priority": "high",
  "ttl": "permanent",
  "content": {
    "description": "Testing patterns and best practices",
    "patterns": [],
    "anti_patterns": [],
    "frameworks": {},
    "coverage_standards": {}
  },
  "access_count": 0,
  "last_accessed": null
}
