{
  "id": "mem_e16eba5a072c",
  "type": "factual",
  "subtype": "network-topology",
  "created_by": "SYSTEM",
  "created_at": "2025-12-18T00:00:00Z",
  "updated_at": "2025-12-18T00:00:00Z",
  "scope": "team",
  "scope_id": "infrastructure",
  "tags": [
    "network",
    "topology",
    "infrastructure",
    "connectivity"
  ],
  "priority": "high",
  "ttl": "permanent",
  "content": {
    "description": "Network topology and connectivity information",
    "networks": [],
    "firewalls": [],
    "vpns": [],
    "dns": {},
    "load_balancers": []
  },
  "access_count": 0,
  "last_accessed": null
}
