{
  "id": "mem_a47d85fa08f5",
  "type": "factual",
  "subtype": "compliance-requirements",
  "created_by": "SYSTEM",
  "created_at": "2025-12-18T00:00:00Z",
  "updated_at": "2025-12-18T00:00:00Z",
  "scope": "team",
  "scope_id": "security",
  "tags": [
    "compliance",
    "requirements",
    "regulations",
    "audit"
  ],
  "priority": "critical",
  "ttl": "permanent",
  "content": {
    "description": "Compliance requirements and regulatory frameworks",
    "frameworks": {},
    "requirements": [],
    "evidence": [],
    "audit_history": []
  },
  "access_count": 0,
  "last_accessed": null
}
