{
  "id": "mem_learnpattern",
  "type": "procedural",
  "subtype": "learned-patterns",
  "created_by": "SYSTEM",
  "created_at": "2025-12-18T00:00:00Z",
  "updated_at": "2025-12-18T00:00:00Z",
  "scope": "global",
  "scope_id": null,
  "tags": ["patterns", "learnings", "cross-agent", "procedures"],
  "priority": "high",
  "ttl": "permanent",
  "content": {
    "description": "Cross-agent learned patterns and best practices",
    "patterns": [],
    "anti_patterns": [],
    "successful_approaches": [],
    "common_mistakes": []
  },
  "access_count": 0,
  "last_accessed": null
}
