{
  "id": "mem_e1c9a67fcfb0",
  "type": "episodic",
  "subtype": "vulnerability-history",
  "created_by": "SYSTEM",
  "created_at": "2025-12-18T00:00:00Z",
  "updated_at": "2025-12-18T00:00:00Z",
  "scope": "team",
  "scope_id": "security",
  "tags": [
    "vulnerabilities",
    "history",
    "security",
    "findings"
  ],
  "priority": "high",
  "ttl": "permanent",
  "content": {
    "description": "History of discovered vulnerabilities and their remediation",
    "vulnerabilities": []
  },
  "access_count": 0,
  "last_accessed": null
}
