{
  "id": "mem_1c1fa42a829d",
  "type": "factual",
  "subtype": "capacity-baselines",
  "created_by": "SYSTEM",
  "created_at": "2025-12-18T00:00:00Z",
  "updated_at": "2025-12-18T00:00:00Z",
  "scope": "team",
  "scope_id": "infrastructure",
  "tags": [
    "capacity",
    "baselines",
    "performance",
    "metrics"
  ],
  "priority": "high",
  "ttl": "permanent",
  "content": {
    "description": "Capacity baselines and performance metrics",
    "baselines": [],
    "thresholds": {},
    "scaling_rules": [],
    "historical_data": []
  },
  "access_count": 0,
  "last_accessed": null
}
