{
  "id": "mem_8df224aed1af",
  "type": "procedural",
  "subtype": "runbooks",
  "created_by": "SYSTEM",
  "created_at": "2025-12-18T00:00:00Z",
  "updated_at": "2025-12-18T00:00:00Z",
  "scope": "team",
  "scope_id": "infrastructure",
  "tags": [
    "runbooks",
    "procedures",
    "operations",
    "sre"
  ],
  "priority": "critical",
  "ttl": "permanent",
  "content": {
    "description": "Operational runbooks and procedures",
    "runbooks": [],
    "emergency_procedures": [],
    "maintenance_windows": []
  },
  "access_count": 0,
  "last_accessed": null
}
